{
	"schemaVersion": 2,
	"id": "nats-viewer-app",
	"name": "NATS Viewer",
	"version": "1.0.0",
	"description": "NATS message viewer and debugger \u2014 inspect subjects, publish messages, trace flows.",
	"author": "Namastex",
	"license": "Elastic-2.0",
	"repository": "https://github.com/khal-os/app-kit",
	"views": [
		{
			"id": "nats-viewer",
			"label": "NATS Viewer",
			"permission": "nats-viewer",
			"minRole": "platform-dev",
			"defaultSize": {
				"width": 900,
				"height": 600
			},
			"component": "./views/nats-viewer/NatsViewer"
		}
	],
	"desktop": {
		"icon": "/icons/dusk/activity_monitor.svg",
		"categories": ["Development"],
		"comment": "NATS message viewer and debugger"
	},
	"tauri": {
		"exportable": false
	}
}
