{
	"schemaVersion": 1,
	"id": "hello-sac",
	"name": "SAC Co-Pilot",
	"version": "1.0.0",
	"description": "Outbound voice agent cockpit for SAC operations — real-time call management.",
	"author": "Namastex",
	"license": "Elastic-2.0",
	"repository": "https://github.com/khal-os/app-kit",
	"views": [
		{
			"id": "hello-sac",
			"label": "SAC Co-Pilot",
			"permission": "hello-sac",
			"minRole": "platform-admin",
			"natsPrefix": "hello",
			"defaultSize": { "width": 1200, "height": 800 },
			"component": "./views/hello-sac"
		}
	],
	"desktop": {
		"icon": "/icons/dusk/skype.svg",
		"categories": ["Voice"],
		"comment": "Outbound voice agent cockpit for SAC operations"
	},
	"tauri": {
		"exportable": false
	}
}
