{
	"schemaVersion": 1,
	"id": "settings-app",
	"name": "Settings",
	"version": "1.0.0",
	"description": "Desktop settings — manage services, apps, permissions, and system configuration.",
	"author": "Namastex",
	"license": "Elastic-2.0",
	"repository": "https://github.com/khal-os/app-kit",
	"views": [
		{
			"id": "settings",
			"label": "Settings",
			"permission": "settings",
			"minRole": "platform-dev",
			"defaultSize": { "width": 800, "height": 600 },
			"component": "./views/settings/Settings"
		}
	],
	"desktop": {
		"icon": "/icons/dusk/system_preferences.svg",
		"categories": ["System"],
		"comment": "Desktop settings"
	},
	"tauri": {
		"exportable": false
	}
}
